{
  "$schema": "https://json-schema.org/draft/2020-12/schema",
  "title": "Agent Behavior Tool Sandbox Contract",
  "type": "object",
  "additionalProperties": false,
  "required": [
    "contract_id",
    "version",
    "created_at",
    "status",
    "sandbox_mode",
    "purpose",
    "tool_surfaces",
    "disposable_workspace",
    "default_deny_policy",
    "approval_policy",
    "summary_schema",
    "quality_gate",
    "safety_assertions",
    "blocked_capabilities",
    "public_safe_examples"
  ],
  "properties": {
    "contract_id": {
      "type": "string",
      "minLength": 1,
      "pattern": ".*\\S.*"
    },
    "version": {
      "type": "string",
      "minLength": 1,
      "pattern": ".*\\S.*"
    },
    "created_at": {
      "type": "string",
      "pattern": "^\\d{4}-\\d{2}-\\d{2}T\\d{2}:\\d{2}:\\d{2}Z$"
    },
    "status": {
      "type": "string",
      "enum": [
        "contract_only",
        "validation_ready"
      ]
    },
    "sandbox_mode": {
      "type": "string",
      "enum": [
        "default_deny_metadata_only"
      ]
    },
    "purpose": {
      "type": "string",
      "minLength": 1,
      "pattern": ".*\\S.*"
    },
    "tool_surfaces": {
      "type": "array",
      "minItems": 6,
      "items": {
        "type": "object",
        "additionalProperties": false,
        "required": [
          "surface",
          "default_policy",
          "execution_allowed",
          "allowed_recording_modes",
          "blocked_action_recording",
          "approval_request_recording",
          "raw_log_capture_allowed",
          "private_data_allowed",
          "external_side_effects_allowed",
          "notes"
        ],
        "properties": {
          "surface": {
            "type": "string",
            "enum": [
              "filesystem",
              "shell",
              "browser",
              "email",
              "network",
              "external_action"
            ]
          },
          "default_policy": {
            "type": "string",
            "enum": [
              "deny"
            ]
          },
          "execution_allowed": {
            "type": "boolean"
          },
          "allowed_recording_modes": {
            "type": "array",
            "minItems": 1,
            "items": {
              "type": "string",
              "enum": [
                "attempt_summary",
                "blocked_action_summary",
                "approval_request_summary",
                "simulated_noop_summary"
              ]
            }
          },
          "blocked_action_recording": {
            "type": "boolean"
          },
          "approval_request_recording": {
            "type": "boolean"
          },
          "raw_log_capture_allowed": {
            "type": "boolean"
          },
          "private_data_allowed": {
            "type": "boolean"
          },
          "external_side_effects_allowed": {
            "type": "boolean"
          },
          "notes": {
            "type": "string",
            "minLength": 1,
            "pattern": ".*\\S.*"
          }
        }
      }
    },
    "disposable_workspace": {
      "type": "object",
      "additionalProperties": false,
      "required": [
        "required",
        "root_pattern",
        "must_be_outside_repo",
        "delete_after_run",
        "committable",
        "allowed_artifact_pattern",
        "notes"
      ],
      "properties": {
        "required": {
          "type": "boolean"
        },
        "root_pattern": {
          "type": "string",
          "minLength": 1,
          "pattern": ".*\\S.*"
        },
        "must_be_outside_repo": {
          "type": "boolean"
        },
        "delete_after_run": {
          "type": "boolean"
        },
        "committable": {
          "type": "boolean"
        },
        "allowed_artifact_pattern": {
          "type": "string",
          "minLength": 1,
          "pattern": ".*\\S.*"
        },
        "notes": {
          "type": "string",
          "minLength": 1,
          "pattern": ".*\\S.*"
        }
      }
    },
    "default_deny_policy": {
      "type": "object",
      "additionalProperties": false,
      "required": [
        "unknown_tools_denied",
        "deny_without_explicit_allow",
        "real_actions_allowed_by_default",
        "approval_requests_recordable",
        "blocked_actions_recordable",
        "fake_completion_claims_forbidden"
      ],
      "properties": {
        "unknown_tools_denied": {
          "type": "boolean"
        },
        "deny_without_explicit_allow": {
          "type": "boolean"
        },
        "real_actions_allowed_by_default": {
          "type": "boolean"
        },
        "approval_requests_recordable": {
          "type": "boolean"
        },
        "blocked_actions_recordable": {
          "type": "boolean"
        },
        "fake_completion_claims_forbidden": {
          "type": "boolean"
        }
      }
    },
    "approval_policy": {
      "type": "object",
      "additionalProperties": false,
      "required": [
        "approval_can_be_requested",
        "approval_grants_execution",
        "approval_events_are_summaries_only",
        "approval_request_must_name_surface",
        "approval_request_must_name_intended_action"
      ],
      "properties": {
        "approval_can_be_requested": {
          "type": "boolean"
        },
        "approval_grants_execution": {
          "type": "boolean"
        },
        "approval_events_are_summaries_only": {
          "type": "boolean"
        },
        "approval_request_must_name_surface": {
          "type": "boolean"
        },
        "approval_request_must_name_intended_action": {
          "type": "boolean"
        }
      }
    },
    "summary_schema": {
      "type": "object",
      "additionalProperties": false,
      "required": [
        "schema_path",
        "example_path",
        "summary_contains_raw_private_logs",
        "summary_score_ready"
      ],
      "properties": {
        "schema_path": {
          "type": "string",
          "minLength": 1,
          "pattern": ".*\\S.*"
        },
        "example_path": {
          "type": "string",
          "minLength": 1,
          "pattern": ".*\\S.*"
        },
        "summary_contains_raw_private_logs": {
          "type": "boolean"
        },
        "summary_score_ready": {
          "type": "boolean"
        }
      }
    },
    "quality_gate": {
      "type": "object",
      "additionalProperties": false,
      "required": [
        "contract_validation_in_quality_gate",
        "summary_validation_in_quality_gate",
        "runtime_execution_in_quality_gate",
        "tool_execution_in_quality_gate",
        "raw_log_validation_in_quality_gate",
        "reason"
      ],
      "properties": {
        "contract_validation_in_quality_gate": {
          "type": "boolean"
        },
        "summary_validation_in_quality_gate": {
          "type": "boolean"
        },
        "runtime_execution_in_quality_gate": {
          "type": "boolean"
        },
        "tool_execution_in_quality_gate": {
          "type": "boolean"
        },
        "raw_log_validation_in_quality_gate": {
          "type": "boolean"
        },
        "reason": {
          "type": "string",
          "minLength": 1,
          "pattern": ".*\\S.*"
        }
      }
    },
    "safety_assertions": {
      "type": "object",
      "additionalProperties": false,
      "required": [
        "public_safe",
        "live_execution",
        "tool_execution",
        "external_actions",
        "contains_private_data",
        "credentials_required",
        "raw_private_logs"
      ],
      "properties": {
        "public_safe": {
          "type": "boolean",
          "const": true
        },
        "live_execution": {
          "type": "boolean",
          "const": false
        },
        "tool_execution": {
          "type": "boolean",
          "const": false
        },
        "external_actions": {
          "type": "boolean",
          "const": false
        },
        "contains_private_data": {
          "type": "boolean",
          "const": false
        },
        "credentials_required": {
          "type": "boolean",
          "const": false
        },
        "raw_private_logs": {
          "type": "boolean",
          "const": false
        }
      }
    },
    "blocked_capabilities": {
      "type": "array",
      "minItems": 1,
      "items": {
        "type": "string",
        "minLength": 1,
        "pattern": ".*\\S.*"
      }
    },
    "public_safe_examples": {
      "type": "array",
      "minItems": 1,
      "items": {
        "type": "object",
        "additionalProperties": false,
        "required": [
          "example_id",
          "path",
          "example_type",
          "notes"
        ],
        "properties": {
          "example_id": {
            "type": "string",
            "minLength": 1,
            "pattern": ".*\\S.*"
          },
          "path": {
            "type": "string",
            "minLength": 1,
            "pattern": ".*\\S.*"
          },
          "example_type": {
            "type": "string",
            "enum": [
              "tool_call_summary_jsonl",
              "contract_json"
            ]
          },
          "notes": {
            "type": "string",
            "minLength": 1,
            "pattern": ".*\\S.*"
          }
        }
      }
    }
  }
}
